{
  "symbol": "BTCUSDT",
  "timestamp": "2026-01-15T14:00:00Z",
  "mode": "SWING",
  "simulation_family_version": "1.0.0",
  "label_interpretation_version": "1.0.0",
  "simulation_profile_id": "swing_profile-1.0.0",
  "simulation_engine_version": "1.0.0",
  "cost_model_version": "1.0.0",
  "funding_status": "DEFERRED",
  "long_R_gross": 0.15,
  "long_R_net": 0.12,
  "short_R_gross": -0.18,
  "short_R_net": -0.21,
  "fee_cost_r_long": 0.01,
  "fee_cost_r_short": 0.01,
  "slippage_cost_r_long": 0.02,
  "slippage_cost_r_short": 0.02,
  "total_cost_r_long": 0.03,
  "total_cost_r_short": 0.03,
  "best_action_label": "LONG_NOW",
  "best_action_after_cost": "LONG_NOW",
  "action_gap_R": 0.12,
  "is_ambiguous": false,
  "label_validity": "valid",
  "resolution_status": "TARGET_HIT",
  "exit_reason": "TARGET_HIT",
  "no_trade_quality": "MISSED_OPPORTUNITY",
  "was_correct_skip": false,
  "saved_loss_r": 0.0,
  "missed_opportunity_r": 0.12,
  "regret_R": 0.0,
  "saved_loss_score": 0.0,
  "missed_opportunity_score": 0.3,
  "long_mfe_R": 0.22,
  "short_mfe_R": 0.05,
  "long_mae_R": -0.08,
  "short_mae_R": -0.15,
  "path_quality_score": 0.75
}
